{
  "schema_version": "0.2",
  "deployment_mode": "personal",
  "monitoring_enabled": false,
  "private_space_monitoring_enabled": false,
  "bathroom_monitoring_enabled": false,
  "bedroom_monitoring_enabled": false,
  "real_sensor_ingestion_enabled": true,
  "local_baseline_learning_enabled": true,
  "local_audit_logging_enabled": true,
  "real_contact_notification_enabled": false,
  "requires_contact_test_before_live_alerts": true,
  "authorized_contacts_configured": false,
  "successful_test_alert_completed": false,
  "emergency_services_enabled": false,
  "cloud_dependency_for_core_loop": false,
  "silent_telemetry_enabled": false,
  "diagnostic_upload_enabled": false,
  "raw_sensor_retention": "not_retained",
  "export_requires_explicit_confirmation": true,
  "policy_id": "production-local-v0.2",
  "policy_version": "0.2"
}
